{
  "distractor_policy": {
    "fallback_source": "taxonomic_fallback_db",
    "max_referenced_only_per_question": 0,
    "referenced_only_allowed": false,
    "version": "phase2b.distractors.palier_a.v1"
  },
  "generated_at": "2026-05-09T18:22:26.505476+00:00",
  "locale": "nl",
  "pool_id": "pack-pool:be-fr-birds-50:v1",
  "question_count": 20,
  "questions": [
    {
      "canonical_taxon_id": "taxon:birds:000006",
      "common_name": "Gaai",
      "correct_option_id": "question:2705bc8c7d979363:opt:correct",
      "country_code": "FR",
      "feedback_short": "feather",
      "label_source": "common_name",
      "media": {
        "attribution": "(c) Sylvain Montagner, some rights reserved (CC BY)",
        "license": "cc-by",
        "render_url": "https://inaturalist-open-data.s3.amazonaws.com/photos/558981425/original.jpg"
      },
      "media_asset_id": "media:inaturalist:558981425",
      "options": [
        {
          "canonical_taxon_id": "taxon:birds:000048",
          "common_name": "Kauw",
          "display_label": "Kauw",
          "is_correct": false,
          "label_source": "common_name",
          "option_id": "question:2705bc8c7d979363:opt:d2",
          "reason_codes": [
            "taxonomic_neighbor_same_family"
          ],
          "referenced_only": false,
          "relationship_id": "dr:f19fc04434cb",
          "scientific_name": "Coloeus monedula",
          "score": 0.6,
          "source": "taxonomic_neighbor_same_family"
        },
        {
          "canonical_taxon_id": "taxon:birds:000049",
          "common_name": "Roek",
          "display_label": "Roek",
          "is_correct": false,
          "label_source": "common_name",
          "option_id": "question:2705bc8c7d979363:opt:d3",
          "reason_codes": [
            "taxonomic_neighbor_same_family"
          ],
          "referenced_only": false,
          "relationship_id": "dr:85aabda7ebcf",
          "scientific_name": "Corvus frugilegus",
          "score": 0.6,
          "source": "taxonomic_neighbor_same_family"
        },
        {
          "canonical_taxon_id": "taxon:birds:000006",
          "common_name": "Gaai",
          "display_label": "Gaai",
          "is_correct": true,
          "label_source": "common_name",
          "option_id": "question:2705bc8c7d979363:opt:correct",
          "reason_codes": [
            "correct_taxon"
          ],
          "referenced_only": false,
          "scientific_name": "Garrulus glandarius",
          "score": 1.0,
          "source": "target_taxon"
        },
        {
          "canonical_taxon_id": "taxon:birds:000016",
          "common_name": "Putter",
          "display_label": "Putter",
          "is_correct": false,
          "label_source": "common_name",
          "option_id": "question:2705bc8c7d979363:opt:d1",
          "reason_codes": [
            "inaturalist_similar_species"
          ],
          "referenced_only": false,
          "relationship_id": "dr:c88c0b623aa3",
          "scientific_name": "Carduelis carduelis",
          "score": 1.0,
          "source": "inaturalist_similar_species"
        }
      ],
      "playable_item_id": "playable:qr:media:inaturalist:558981425",
      "question_id": "question:2705bc8c7d979363",
      "question_index": 1,
      "scientific_name": "Garrulus glandarius"
    },
    {
      "canonical_taxon_id": "taxon:birds:000015",
      "common_name": "Zanglijster",
      "correct_option_id": "question:bdaebeab186a0209:opt:correct",
      "country_code": "FR",
      "feedback_short": "head",
      "label_source": "common_name",
      "media": {
        "attribution": "(c) Yves Bas, some rights reserved (CC BY)",
        "license": "cc-by",
        "render_url": "https://inaturalist-open-data.s3.amazonaws.com/photos/78441693/original.jpeg"
      },
      "media_asset_id": "media:inaturalist:78441693",
      "options": [
        {
          "canonical_taxon_id": "taxon:birds:000015",
          "common_name": "Zanglijster",
          "display_label": "Zanglijster",
          "is_correct": true,
          "label_source": "common_name",
          "option_id": "question:bdaebeab186a0209:opt:correct",
          "reason_codes": [
            "correct_taxon"
          ],
          "referenced_only": false,
          "scientific_name": "Turdus philomelos",
          "score": 1.0,
          "source": "target_taxon"
        },
        {
          "canonical_taxon_id": "taxon:birds:000004",
          "common_name": "Roodborst",
          "display_label": "Roodborst",
          "is_correct": false,
          "label_source": "common_name",
          "option_id": "question:bdaebeab186a0209:opt:d3",
          "reason_codes": [
            "inaturalist_similar_species"
          ],
          "referenced_only": false,
          "relationship_id": "dr:ed4f55341f3e",
          "scientific_name": "Erithacus rubecula",
          "score": 1.0,
          "source": "inaturalist_similar_species"
        },
        {
          "canonical_taxon_id": "taxon:birds:000009",
          "common_name": "Huismus",
          "display_label": "Huismus",
          "is_correct": false,
          "label_source": "common_name",
          "option_id": "question:bdaebeab186a0209:opt:d2",
          "reason_codes": [
            "inaturalist_similar_species"
          ],
          "referenced_only": false,
          "relationship_id": "dr:2a22a45007e4",
          "scientific_name": "Passer domesticus",
          "score": 1.0,
          "source": "inaturalist_similar_species"
        },
        {
          "canonical_taxon_id": "taxon:birds:000014",
          "common_name": "Merel",
          "display_label": "Merel",
          "is_correct": false,
          "label_source": "common_name",
          "option_id": "question:bdaebeab186a0209:opt:d1",
          "reason_codes": [
            "inaturalist_similar_species"
          ],
          "referenced_only": false,
          "relationship_id": "dr:f37eecda0ccf",
          "scientific_name": "Turdus merula",
          "score": 1.0,
          "source": "inaturalist_similar_species"
        }
      ],
      "playable_item_id": "playable:qr:media:inaturalist:78441693",
      "question_id": "question:bdaebeab186a0209",
      "question_index": 2,
      "scientific_name": "Turdus philomelos"
    },
    {
      "canonical_taxon_id": "taxon:birds:000079",
      "common_name": "Turkse Tortel",
      "correct_option_id": "question:b2885910b5c44684:opt:correct",
      "country_code": "FR",
      "feedback_short": "head",
      "label_source": "common_name",
      "media": {
        "attribution": "no rights reserved",
        "license": "cc0",
        "render_url": "https://inaturalist-open-data.s3.amazonaws.com/photos/324780165/original.jpeg"
      },
      "media_asset_id": "media:inaturalist:324780165",
      "options": [
        {
          "canonical_taxon_id": "taxon:birds:000079",
          "common_name": "Turkse Tortel",
          "display_label": "Turkse Tortel",
          "is_correct": true,
          "label_source": "common_name",
          "option_id": "question:b2885910b5c44684:opt:correct",
          "reason_codes": [
            "correct_taxon"
          ],
          "referenced_only": false,
          "scientific_name": "Streptopelia decaocto",
          "score": 1.0,
          "source": "target_taxon"
        },
        {
          "canonical_taxon_id": "taxon:birds:000033",
          "common_name": "Torenvalk",
          "display_label": "Torenvalk",
          "is_correct": false,
          "label_source": "common_name",
          "option_id": "question:b2885910b5c44684:opt:d1",
          "reason_codes": [
            "inaturalist_similar_species"
          ],
          "referenced_only": false,
          "relationship_id": "dr:646c788babb9",
          "scientific_name": "Falco tinnunculus",
          "score": 1.0,
          "source": "inaturalist_similar_species"
        },
        {
          "canonical_taxon_id": "taxon:birds:000001",
          "common_name": "Houtduif",
          "display_label": "Houtduif",
          "is_correct": false,
          "label_source": "common_name",
          "option_id": "question:b2885910b5c44684:opt:d2",
          "reason_codes": [
            "inaturalist_similar_species"
          ],
          "referenced_only": false,
          "relationship_id": "dr:fe4ed74b9217",
          "scientific_name": "Columba palumbus",
          "score": 1.0,
          "source": "inaturalist_similar_species"
        },
        {
          "canonical_taxon_id": "taxon:birds:000009",
          "common_name": "Huismus",
          "display_label": "Huismus",
          "is_correct": false,
          "label_source": "common_name",
          "option_id": "question:b2885910b5c44684:opt:d3",
          "reason_codes": [
            "inaturalist_similar_species"
          ],
          "referenced_only": false,
          "relationship_id": "dr:cdef60f20ede",
          "scientific_name": "Passer domesticus",
          "score": 1.0,
          "source": "inaturalist_similar_species"
        }
      ],
      "playable_item_id": "playable:qr:media:inaturalist:324780165",
      "question_id": "question:b2885910b5c44684",
      "question_index": 3,
      "scientific_name": "Streptopelia decaocto"
    },
    {
      "canonical_taxon_id": "taxon:birds:000038",
      "common_name": "Groene specht",
      "correct_option_id": "question:c91466c9012d0031:opt:correct",
      "country_code": "FR",
      "feedback_short": "body",
      "label_source": "common_name",
      "media": {
        "attribution": "(c) Bastien Alegot, some rights reserved (CC BY)",
        "license": "cc-by",
        "render_url": "https://inaturalist-open-data.s3.amazonaws.com/photos/103003502/original.jpeg"
      },
      "media_asset_id": "media:inaturalist:103003502",
      "options": [
        {
          "canonical_taxon_id": "taxon:birds:000040",
          "common_name": "Zwarte Specht",